<?xml version="1.0" encoding="UTF-8" ?>
<cdl:copyright xmlns:cdl="http://www.cdlib.org/inside/diglib/copyrightMD"
           xmlns:dk="http://id.kb.dk/dk-corporate-creator"
           xmlns:xsi="http://www.w3.org/2001/XMLSchema-instance"
           xsi:schemaLocation="http://www.cdlib.org/inside/diglib/copyrightMD https://raw.githubusercontent.com/kb-dk/rights-access-metadata/master/copyright-md.xsd"
           copyright.status="copyrighted"
           publication.status="unknown">

  <!-- 
       Possible copyright.statuses are:

       copyrighted
       pd public domain, no further info
       pd_expired public domain, because of expired copyright
       pd_holder public domain, Item dedicated to the public domain by the rights holder.
       pd_usfed public domain, US federal documents are not under copyright.
       unknown
  -->
  

  <cdl:creation>
    <cdl:year.creation year.type="approximate">1920</cdl:year.creation>
    <cdl:country.creation iso.code="dk">Danmark</cdl:country.creation>
  </cdl:creation>
  <cdl:creator>
    <dk:creator.corporate>
      <cdl:name>Ugens nyheder</cdl:name>
      <dk:year.started>1910</dk:year.started>
      <dk:year.ended>1920</dk:year.ended>
    </dk:creator.corporate>
  </cdl:creator>
  <cdl:creator>
    <cdl:creator.person>
      <cdl:name>Petersen, Clara</cdl:name>
      <cdl:year.birth>1890</cdl:year.birth>
      <cdl:year.death>1960</cdl:year.death>
    </cdl:creator.person>
  </cdl:creator>
  <cdl:rights.holder>
    <cdl:name>Estate of Petersen, Clara</cdl:name>
    <cdl:contact> user@domain or whatever  </cdl:contact>
  </cdl:rights.holder>


  <cdl:general.note>Transmission or reproduction of materials protected by
  copyright beyond that allowed by fair use requires the written
  permission of the copyright owners.
  bla bla bla bla bla bla bla</cdl:general.note>

</cdl:copyright>
